{
  "schema": "crabbox-devtools-image-recipe/v1",
  "id": "linux-x86_64",
  "platform": {
    "os": "linux",
    "architecture": "x86_64"
  },
  "execution": {
    "command": "bash",
    "arguments": ["scripts/install-linux-developer-tools.sh"],
    "environment": {}
  },
  "inputs": [
    {
      "path": "scripts/install-linux-developer-tools.sh",
      "sha256": "sha256:2f8a3a1aba2a0f4259653d917d40076bd5291fe0683881118b7ad0fe082a7dc9"
    },
    {
      "path": "scripts/linux-readiness.generated.sh",
      "sha256": "sha256:5f2df62714766bf506272842930d6acce07f79405fe02bf22bb93f5571478394"
    }
  ]
}
